{"files":[{"path":"artifacts/audit/ENDPOINTS_CATALOG.json","sha256":"acb7830656c4aa61451130154110fc30353173a662e11bf74add17c289382b02","size":3222},{"path":"artifacts/audit/ENDPOINTS_CATALOG.json.path_proof.txt","sha256":"6900cd09bf19b7a9972e7fa4c0184a1b19d65f9f5888d0d74aa44b87edffda90","size":205},{"path":"artifacts/audit/ENDPOINTS_CATALOG.json.sha256","sha256":"620c1a922f7e5a2930ff2d3f684a5e5fd70f1b6a99b924f7bf1c673538deb4e3","size":105},{"path":"artifacts/audit/ENDPOINTS_CATALOG.json.sha256.path_proof.txt","sha256":"e3be50831479d17297a381f9cf825448759769a128a14a145064fad72e47083d","size":211},{"path":"artifacts/bodygraph/keys_only.logs.sample","sha256":"34b06e32dcacdc1ba50b5eccb5e93cdb80707e81b0d80f7bd15fd2d62d19fef2","size":129},{"path":"artifacts/bodygraph/keys_only.logs.sample.path_proof.txt","sha256":"70873f8308d5d68d2788b33ee92ace8999f578cfefeb4ae460e4d5063dbed22a","size":207},{"path":"artifacts/bodygraph/metrics.snapshot.json","sha256":"7b6ee5162d79a17bd880c2ad5524491bb795f7a70997366dc5ce766ff836d011","size":274},{"path":"artifacts/bodygraph/metrics.snapshot.json.path_proof.txt","sha256":"30028e993f5a2878aaba668d7862eb5826e7b72f9f8d8a03ceb36ee2558356b5","size":207},{"path":"artifacts/bodygraph/refresh_policy.snapshot.json","sha256":"b36bf3cd7a6ae23d5d70c200f07a0bfcf89b42589ac81c85feae1cfa396acb68","size":473},{"path":"artifacts/bodygraph/refresh_policy.snapshot.json.path_proof.txt","sha256":"4f60048617b88d46849c02774666f960281dfa852c9c445e0f6cd5e1d658be20","size":214},{"path":"artifacts/bodygraph/release_bindings.json","sha256":"4cdd4c087a5504bf1c6bc790116ec3de8365e3c6d29d5884be9ac19538c08572","size":578},{"path":"artifacts/bodygraph/release_bindings.json.path_proof.txt","sha256":"3cde5cfb67fbac12ca97839a3863d5af3a217f2bdb01627c29e21f195ae1991d","size":207},{"path":"artifacts/bodygraph/source_invariance/ab.json","sha256":"e989f7e874a9dafac078662042873f167d13ab0d4b0d4fc66e52834484b15c5b","size":1845},{"path":"artifacts/bodygraph/source_invariance/ab.json.path_proof.txt","sha256":"9d84dd2d30742769a94294bd098df01e61e92d555f2eca0f879b15bc095f3cb2","size":212},{"path":"artifacts/bodygraph/source_invariance/ba.json","sha256":"5ddf5655a25461000dd0f54f6a649c69e21bd652676f7fb569068b8b7e59eca3","size":1845},{"path":"artifacts/bodygraph/source_invariance/ba.json.path_proof.txt","sha256":"739c749cf73335ff8c1ced986f3f0385a783b8db6a9f85c2208ffd76747fd61c","size":212},{"path":"artifacts/bodygraph/source_invariance/summary.json","sha256":"509e1403561a6ff722294d2d17801fb2ce2050c5df4fe1c9eb83296c833c5de5","size":1460},{"path":"artifacts/bodygraph/source_invariance/summary.json.path_proof.txt","sha256":"2610a1c0a036a428ad83e749eb38add4a42a3c4eae76a5dc5b7a6cfa1bbb58f8","size":217},{"path":"artifacts/bodygraph/source_selection.snapshot.json","sha256":"3e03333be6eb4b6cdaf7bacab883933352b8ade5af09c845c87450b2af9e3101","size":666},{"path":"artifacts/bodygraph/source_selection.snapshot.json.path_proof.txt","sha256":"077a8aa0ad401fe5d3e6d7a65c9ce47b9c6590a808836732650d90156c0e52bd","size":216},{"path":"artifacts/bodygraph/v2_mapped_cache/canonical_parity.log","sha256":"8393ee37d8893e0ee38c10b20ecc25f2c3aa3b202d3b9d3b7a0e98b80ae1f9e9","size":114},{"path":"artifacts/bodygraph/v2_mapped_cache/canonical_parity.log.path_proof.txt","sha256":"01b340bb7fe94580b39bf39ac42b60e655db8203172a03021c33ff59b4aa0df1","size":222},{"path":"artifacts/bodygraph/v2_mapped_cache/closed_rails_refusal.log","sha256":"fca08837150d77523f14a14cc8f54e9ebd63545fedf26f40329c8874733f4e53","size":81},{"path":"artifacts/bodygraph/v2_mapped_cache/closed_rails_refusal.log.path_proof.txt","sha256":"874fbe7d84a0662a5ca6081d3fbf070f3996a192414ec7c944e68dcfe6fc4c25","size":225},{"path":"artifacts/bodygraph/v2_mapped_cache/idempotence.log","sha256":"024367ade0a4b5d398ed87283e04813c4bd89eedfa0932e746a642a4a6b84476","size":94},{"path":"artifacts/bodygraph/v2_mapped_cache/idempotence.log.path_proof.txt","sha256":"02c5ee3b0c11739924a050f4a78f96c19041a270cf42d4a87bdbede31776b4a0","size":216},{"path":"artifacts/bodygraph/v2_mapped_cache/legacy_fallback_preservation.log","sha256":"c47daffeae8c2022c706888a85659be3d252cff24a6ceb46d31eb3a10e038eb8","size":96},{"path":"artifacts/bodygraph/v2_mapped_cache/legacy_fallback_preservation.log.path_proof.txt","sha256":"181d014c63477616b3d77cd5c8b6f7a10d5482ece6dcc2c23a84b35cb85a229a","size":233},{"path":"artifacts/bodygraph/v2_mapped_cache/manifest.json","sha256":"9e2f7432c8c7f225402aad9743f816dd485b14dc5ec09485e0528f751924c8a4","size":2261},{"path":"artifacts/bodygraph/v2_mapped_cache/manifest.json.path_proof.txt","sha256":"0727b4e033eec0f6f5f98a2dd33ae563e0c350835de1e7d30367c8003444c287","size":216},{"path":"artifacts/bodygraph/v2_mapped_cache/no_raw_vendor_payload_persistence.log","sha256":"5bcd38db26c9c018dce74cbdb02a8bf19c5621a8fa81775aaaa10b6af25e9b54","size":72},{"path":"artifacts/bodygraph/v2_mapped_cache/no_raw_vendor_payload_persistence.log.path_proof.txt","sha256":"6968a432751cd4497dcf83f30e23b8ddd98f45a168e9687ab5347253df16e770","size":238},{"path":"artifacts/bodygraph/v2_mapped_cache/read_back_transcript.json","sha256":"2f68ab6b4163e6f9145d6ea32b253991dd7c2e8cd3f00597ef3dec20702c87f4","size":533},{"path":"artifacts/bodygraph/v2_mapped_cache/read_back_transcript.json.path_proof.txt","sha256":"2f24ce62a8d37460cab91c6ad95260ab0e6e93398412943ccbb20ee5074aef68","size":227},{"path":"artifacts/bodygraph/v2_mapped_cache/write_transcript.json","sha256":"7b9fbda6c93074a7edff9d424001eb4a5c6b55e0b9ecba4f9c9fa4b92ed2f95e","size":529},{"path":"artifacts/bodygraph/v2_mapped_cache/write_transcript.json.path_proof.txt","sha256":"d3b1a86df4d7e61c41b726a5dcb11354ecd5f5a094b8f8657f24f1f06aea0817","size":223},{"path":"artifacts/cards/a3/IDENTITY_OK.txt","sha256":"88e48239a5a3ec45c7ccf67cb1a3c460c9db164a01ef7ae2e6e2e5d7de88e66d","size":111},{"path":"artifacts/cards/a3/IDENTITY_OK.txt.path_proof.txt","sha256":"e43dafcf5b707e68f34fb3383e9e207ef33c2ccf03ee42517da63fcfa068bb2e","size":200},{"path":"artifacts/cli/ab.json","sha256":"5582da30c13f4194e6e09de24839b98eaf79e2a49dc5cfde46f930c1c216d6f9","size":1526},{"path":"artifacts/cli/ab.json.path_proof.txt","sha256":"efce425bed0b29d2d4c016f7bfbbd06ba2d29d0c747713ce8a9cbdde6857db73","size":188},{"path":"artifacts/cli/ba.json","sha256":"5582da30c13f4194e6e09de24839b98eaf79e2a49dc5cfde46f930c1c216d6f9","size":1526},{"path":"artifacts/cli/ba.json.path_proof.txt","sha256":"bcfb9d6427c1a67f0c3af3cbda8f59aee0601814c9b6bd4ff2587f88e1ac6cdb","size":188},{"path":"artifacts/cli/help/hdctl_help.txt","sha256":"3dfb564807a9a2bc0358c6f4db4edb20d9c454ef476e33161cce9c92629fba6a","size":717},{"path":"artifacts/cli/help/hdctl_help.txt.path_proof.txt","sha256":"ed3358c7850d9d1a57478175f320e682cc399c8804a323a858ebe5d3d3e357f1","size":199},{"path":"artifacts/cli/help/reject_nonjson.txt","sha256":"0a51d40addd8810b3c0a3d9e8fab0784a05cdee4c2d6ff58c8a198be3b9b9288","size":13},{"path":"artifacts/cli/help/reject_nonjson.txt.path_proof.txt","sha256":"f3cdf49056ffd7019cd9d7e3170ee53121966e3cde67ebbb4b6360fe3f7ded34","size":202},{"path":"artifacts/cli/help/showcompat_help.txt","sha256":"f9cdc8861dee7e3fb5f34c244e56a66f4660f679f29e6cd0badf28690ea82035","size":2361},{"path":"artifacts/cli/help/showcompat_help.txt.path_proof.txt","sha256":"483e19942d0518559d86601f88dc93061295a840ce9d491391feec0cc504254a","size":205},{"path":"artifacts/cli/install/entrypoints.txt","sha256":"5fb3ce59e35e1899109183ca9405260cdfa81c147d44ba4fd4de5646165c15bd","size":408},{"path":"artifacts/cli/install/entrypoints.txt.path_proof.txt","sha256":"97d364a14a62bf6d6143a40ec8a0b4a4bf35055744ebc6169b675cc845aa3306","size":203},{"path":"artifacts/cli/install/installability_summary.json","sha256":"bf15c44014a6d98d6f2856e5ef89bfdf79359f31527b7336898fb7b993cd548e","size":935},{"path":"artifacts/cli/install/installability_summary.json.path_proof.txt","sha256":"393051b801ea89577b7d771cdc5da3c9d120ffbd69333eae03c3a159338d22ee","size":215},{"path":"artifacts/cli/summary.json","sha256":"99438fb0f1cdfef6346d6792bf2d9d1a172717226d0ba0e224fd4298bb7cc2cd","size":2297},{"path":"artifacts/cli/summary.json.path_proof.txt","sha256":"ae4e8d164580bc339de7e3cd9f3794a9174fc01750ad6d58e01764b65a721078","size":193},{"path":"artifacts/config_bundles/be_bundle.json","sha256":"b7524bde903a02a7d8ad70ba52ccdb9175210de06074c432379debf5fbbbdc4e","size":8822},{"path":"artifacts/config_bundles/be_bundle.json.path_proof.txt","sha256":"c076016b4362aad31a0a0334d0727cc5b5b5a93ae0df7aea5d8b930867a7fbf3","size":206},{"path":"artifacts/config_bundles/fe_bundle.json","sha256":"ffce2dbb81f1cf7eedbe1a44f23d4bee4e8e05b051c087e7e676faac3f3a12a4","size":2201},{"path":"artifacts/config_bundles/fe_bundle.json.path_proof.txt","sha256":"ffd35a7beabfa5fd0cf6df175c9bb367f1dc00b069954606c01079a095f7502f","size":206},{"path":"artifacts/db/boundary_view.readonly.proof.txt","sha256":"e86aa1373e4e5c4b8774506a99c4659e89e4fd2897f81b688265b73eca260aeb","size":198},{"path":"artifacts/db/boundary_view.readonly.proof.txt.path_proof.txt","sha256":"38e7f5a131f7a3b314c32e0159c65e024a36808e97225260e03743f789868264","size":211},{"path":"artifacts/db/check_constraints.txt","sha256":"9add416795022732b73947e70c3ba6cd240f43415d7604302ef8690ba2b465aa","size":772},{"path":"artifacts/db/check_constraints.txt.path_proof.txt","sha256":"607558272e9687adddf317be42809e231baf45ef1f01d4da0a9fd975bd30cc1b","size":200},{"path":"artifacts/db/check_schema.txt","sha256":"239944b558d2dcf93e254a3ab36884c17408f31ee738c2fa540c26ec5cc9aa34","size":12},{"path":"artifacts/db/check_schema.txt.path_proof.txt","sha256":"3ce617e0b50a1cccfee0c11ec977555c4e5d84562473596cadbb3a0bb157cb8b","size":194},{"path":"artifacts/db/ddl_fingerprint.json","sha256":"42ab602694f691e49fc98563e9d51e955a3de0ab377b318ce1f0d60fee90647f","size":317},{"path":"artifacts/db/ddl_fingerprint.json.path_proof.txt","sha256":"2a430abe4a770646dce56d4f58d9c9fe8314e71bf2bde1de53badad82ca06c94","size":199},{"path":"artifacts/db/grants.txt","sha256":"02c6075a80f7f4d35ee97cb986f5564a3155d090edc5